{
  "$schema": "https://json-schema.org/draft/2020-12/schema",
  "title": "App & Mini Program AgentInput",
  "type": "object",
  "required": [
    "taskId",
    "appPackages"
  ],
  "properties": {
    "taskId": {
      "type": "string"
    },
    "priority": {
      "type": "string",
      "enum": [
        "low",
        "medium",
        "high",
        "urgent"
      ]
    },
    "appPackages": {
      "type": "array",
      "items": {
        "type": "object"
      }
    },
    "context": {
      "type": "object"
    },
    "upstreamRefs": {
      "type": "array",
      "items": {
        "type": "string"
      }
    },
    "constraints": {
      "type": "object"
    }
  }
}